name,url,slug,hanen_categories,inferred_product_categories,matched_product_terms,address,phone,email,website,contact_person,evidence_snippets,error
Aimees Farm,https://www.hanen.no/bedrift/aimees-farm/,aimees-farm,Gårdsbutikker; Mat-og drikkeprodusenter; Servering,meat; fruit_vegetables_and_potatoes; prepared_foods_and_sales_channels; dairy_and_eggs; fish_and_seafood; bakery_and_grains; drinks; preserves_condiments_and_honey,"{""bakery_and_grains"": [""brød""], ""dairy_and_eggs"": [""halloumi"", ""melk"", ""oster""], ""drinks"": [""kaffe"", ""saft""], ""fish_and_seafood"": [""fisk"", ""lofoten seaweed""], ""fruit_vegetables_and_potatoes"": [""gulløye"", ""nypotet"", ""potet"", ""van gogh"", ""grønnsak""], ""meat"": [""burger"", ""høylandsfe"", ""kjøtt"", ""landsvin"", ""utegris""], ""prepared_foods_and_sales_channels"": [""abonnement"", ""bondens marked"", ""delikatesse"", ""lokalmat"", ""middag"", ""reko-ringen"", ""utsalg""], ""preserves_condiments_and_honey"": [""marmelade""]}","Valbergsveien 132, 8340 Stamsund",+47 48 02 83 44,post@aimeesfarm.no,https://aimeesfarm.no/,Aimee Cathrin Larsen,"Vi tar imot grupper på gården og selger produkter direkte fra vårt utsalg, på Bondens Marked og reko-ringen.; I restauranten har vi åpent for lunsjservering og middag.; Derfor er det mye kjøtt; gressfôra, utegang, Lofotlam, høylandsfe og utegris.; Likevel har vi alltid et vegetarisk alternativ på menyen og veldig ofte også en fiskerett.; På bildet er det ei grønnsakssuppe servert i håndlaget keramikk fra Rokkvika Porselensfabrikk.; Burger med hjemmebakt brød, halloumi eller høylandsfe er fast innslag.; I utsalget vårt (samme adresse som restauranten) har vi alltid et godt utvalg lokale oster, marmelader som veksler med sesongen, saft, kaffe fra Keans Beans i Laukvik, ulike produkter fra Lofoten Seaweed og Judiths urtehage.; I tillegg fører vi et variert utvalg lokalmat fra andre småprodusenter i vårt område.; Vi fôrer ikke med kraftfôr, men gir litt brød for å sosialisere dyrene og enkelt kunne arbeide med dem.; Kalvene går sammen med kyrne og får både en lang periode med melk i tillegg til at de tidlig tar til seg grovfôr fordi de kopierer mødrene ute på beita.",
Bakke Gård,https://www.hanen.no/bedrift/bakke-gaard/,bakke-gaard,Gårdsbutikker; Mat-og drikkeprodusenter,bakery_and_grains,"{""bakery_and_grains"": [""bakeri""]}","Nedre Bakke, 3340 Åmot",+47970895814797619909,post@bakke-gard.no,https://www.bakke-gard.no/,Anne Karin Bøhn,"Vi er et lite gårdsbakeri som ligger på Bakke gård, på grensen mellom Modum og Sigdal kommune.",
Bakken Øvre Gårdsmat,https://www.hanen.no/bedrift/bakken-ovre-gaardsmat/,bakken-ovre-gaardsmat,Gårdsbutikker; Mat-og drikkeprodusenter,prepared_foods_and_sales_channels; meat,"{""meat"": [""storfe""], ""prepared_foods_and_sales_channels"": [""bondens marked"", ""gårdsbutikk""]}","Østre Skogbygdvei 601, 2340 Løten",+6259480590512670,olemki@online.no,http://www.bakkenovre.com/,,"Vi har en gård i nærheten av Rokosjøen i Løten med 60 kuer 400 storfe og 200 høner.; Alle våre produkter selges fra egen gårdsbutikk og på Bondens Marked, kom å besøk oss her!",
Bakkevig Gard,https://www.hanen.no/bedrift/bakkevig-gard/,bakkevig-gard,Aktiviteter og opplevelser; Gårdsbutikker; Mat-og drikkeprodusenter; Overnatting,fruit_vegetables_and_potatoes; meat; fish_and_seafood,"{""fish_and_seafood"": [""fisk""], ""fruit_vegetables_and_potatoes"": [""jordbær"", ""potet""], ""meat"": [""sau""]}","Bakkavik, Liarvågvegen 681, 5560 Nedstrand",+47 41 03 09 52,kbakkevig@hotmail.com,https://www.bakkevig-gard.no/,Kamilla Bakkevig,"Me driv med Gammalnorsk sau, grasproduksjon, jordbær, litt potet/grønsaker og utleige av hytter.",
Beiarmat,https://www.hanen.no/bedrift/beiarmat-as/,beiarmat-as,Gårdsbutikker; Mat-og drikkeprodusenter; Overnatting,dairy_and_eggs; prepared_foods_and_sales_channels; meat; fruit_vegetables_and_potatoes,"{""dairy_and_eggs"": [""geitost"", ""ost"", ""oster"", ""ysteri""], ""fruit_vegetables_and_potatoes"": [""potet""], ""meat"": [""geit"", ""kjøtt""], ""prepared_foods_and_sales_channels"": [""lokalmat"", ""servering"", ""utsalg""]}","Vestre Beiarveien 1042, 8114 Tollå",+47 91 33 24 97,post@beiarmat.no,https://www.beiarmat.no/,Jørgen Storhaug,"Vi lager ost- og kjøttprodukter av geit og kje fra egen produksjon, i fantastiske lokaler i det nye kommunale næringsbygget for lokalmat på Trones i Beiarn.; Vårt utsalg ""Spiskammerset"" har åpent alle dager og er stort sett selvbetjent med Vipps.; Vi drifter det gamle seteranlegget på Staupåmoen, med overnatting og servering.; Naturell hvit geitost, ung og frisk i smaken.; En av våre Spesialiteter, whiskyrøkt hvit geitost.; Ung halvfast hvit geitost, som er røkt på spon av bjørk og or fra egen skog, samt spon fra gamle whiskyfat.; Pakking av Beiarværing, en 6 måneders fast hvit geitost.; Vellagrede oster av både geit og ku, henholdvis Beiarværing og Beiarkua.; ""1839 Lokalmat"" på Trones i Beiarn, et kommunalt næringsbygg for en samlet lokalmatsektor i Beiarn.; Den gamle brunostgryta fra Misvær ysteri foran i bildet.",
